{
  "$schema": "http://json-schema.org/draft-07/schema#",
  "title": "Team",
  "type": "array",
  "items": {
    "type": "object",
    "required": ["id", "name", "role"],
    "properties": {
      "id": { "type": "string" },
      "name": { "type": "string" },
      "role": { "type": "string" },
      "bio": { "type": "string" },
      "photo": { "type": "string" },
      "linkedin": { "type": "string", "format": "uri" }
    },
    "additionalProperties": false
  }
}